{
  "suite_version": "1.0",
  "profiles": ["forgeops-lifecycle-budget", "forgeops-trace-manifest"],
  "base_fixture": {
    "limits": {"time_ms": 1000, "tokens": 100, "tool_calls": 4, "command_calls": 3, "repair_attempts": 2, "cost_microunits": 500},
    "no_progress_limit": 2,
    "validation_at": "2026-08-19T00:05:00Z",
    "identities": {"task_id": "TASK-W8-001", "run_id": "RUN-W8-001", "correlation_id": "CORR-W8-001"},
    "evidence_catalog": ["EVID-W8-TASK", "EVID-W8-REGRESSION"],
    "artifact_catalog": ["ART-W8-DIFF", "ART-W8-TRACE"],
    "resources": ["processes", "mounts", "leases", "transient_secrets", "workspaces"]
  },
  "cases": [
    {"id":"POSITIVE_BUDGETED_SUCCESS","command_id":"budget-cancel-negative","kind":"positive","mutation":"POSITIVE_BUDGETED_SUCCESS","expected":"PASSED"},
    {"id":"POSITIVE_CANCEL_CLEANUP","command_id":"budget-cancel-negative","kind":"positive","mutation":"POSITIVE_CANCEL_CLEANUP","expected":"PASSED"},
    {"id":"NEGATIVE_TIME_LIMIT","command_id":"budget-cancel-negative","kind":"negative","mutation":"NEGATIVE_TIME_LIMIT","expected":"BUDGET_TIME_EXCEEDED"},
    {"id":"NEGATIVE_TOKEN_LIMIT","command_id":"budget-cancel-negative","kind":"negative","mutation":"NEGATIVE_TOKEN_LIMIT","expected":"BUDGET_TOKEN_EXCEEDED"},
    {"id":"NEGATIVE_TOOL_LIMIT","command_id":"budget-cancel-negative","kind":"negative","mutation":"NEGATIVE_TOOL_LIMIT","expected":"BUDGET_TOOL_EXCEEDED"},
    {"id":"NEGATIVE_COMMAND_LIMIT","command_id":"budget-cancel-negative","kind":"negative","mutation":"NEGATIVE_COMMAND_LIMIT","expected":"BUDGET_COMMAND_EXCEEDED"},
    {"id":"NEGATIVE_REPAIR_LIMIT","command_id":"budget-cancel-negative","kind":"negative","mutation":"NEGATIVE_REPAIR_LIMIT","expected":"BUDGET_REPAIR_EXCEEDED"},
    {"id":"NEGATIVE_COST_LIMIT","command_id":"budget-cancel-negative","kind":"negative","mutation":"NEGATIVE_COST_LIMIT","expected":"BUDGET_COST_EXCEEDED"},
    {"id":"NEGATIVE_DISPATCH_AFTER_LIMIT","command_id":"budget-cancel-negative","kind":"negative","mutation":"NEGATIVE_DISPATCH_AFTER_LIMIT","expected":"DISPATCH_FORBIDDEN"},
    {"id":"NEGATIVE_DISPATCH_AFTER_CANCEL","command_id":"budget-cancel-negative","kind":"negative","mutation":"NEGATIVE_DISPATCH_AFTER_CANCEL","expected":"RUN_CANCELLED"},
    {"id":"NEGATIVE_PROCESS_RESIDUE","command_id":"budget-cancel-negative","kind":"negative","mutation":"NEGATIVE_PROCESS_RESIDUE","expected":"PROCESS_RESIDUE"},
    {"id":"NEGATIVE_MOUNT_RESIDUE","command_id":"budget-cancel-negative","kind":"negative","mutation":"NEGATIVE_MOUNT_RESIDUE","expected":"MOUNT_RESIDUE"},
    {"id":"NEGATIVE_LEASE_RESIDUE","command_id":"budget-cancel-negative","kind":"negative","mutation":"NEGATIVE_LEASE_RESIDUE","expected":"LEASE_RESIDUE"},
    {"id":"NEGATIVE_SECRET_RESIDUE","command_id":"budget-cancel-negative","kind":"negative","mutation":"NEGATIVE_SECRET_RESIDUE","expected":"SECRET_RESIDUE"},
    {"id":"NEGATIVE_WORKSPACE_RESIDUE","command_id":"budget-cancel-negative","kind":"negative","mutation":"NEGATIVE_WORKSPACE_RESIDUE","expected":"WORKSPACE_RESIDUE"},
    {"id":"NEGATIVE_CLEANUP_NOT_IDEMPOTENT","command_id":"budget-cancel-negative","kind":"negative","mutation":"NEGATIVE_CLEANUP_NOT_IDEMPOTENT","expected":"CLEANUP_NOT_IDEMPOTENT"},
    {"id":"POSITIVE_PROGRESS_CONTINUES","command_id":"no-progress-stop","kind":"positive","mutation":"POSITIVE_PROGRESS_CONTINUES","expected":"PASSED"},
    {"id":"POSITIVE_SIGNATURE_CHANGE_CONTINUES","command_id":"no-progress-stop","kind":"positive","mutation":"POSITIVE_SIGNATURE_CHANGE_CONTINUES","expected":"PASSED"},
    {"id":"NEGATIVE_IDENTICAL_SIGNATURE","command_id":"no-progress-stop","kind":"negative","mutation":"NEGATIVE_IDENTICAL_SIGNATURE","expected":"NO_PROGRESS_STOPPED"},
    {"id":"NEGATIVE_EVIDENCE_UNCHANGED","command_id":"no-progress-stop","kind":"negative","mutation":"NEGATIVE_EVIDENCE_UNCHANGED","expected":"NO_PROGRESS_STOPPED"},
    {"id":"NEGATIVE_DIFF_UNCHANGED","command_id":"no-progress-stop","kind":"negative","mutation":"NEGATIVE_DIFF_UNCHANGED","expected":"NO_PROGRESS_STOPPED"},
    {"id":"NEGATIVE_NO_PROGRESS_LIMIT","command_id":"no-progress-stop","kind":"negative","mutation":"NEGATIVE_NO_PROGRESS_LIMIT","expected":"NO_PROGRESS_STOPPED"},
    {"id":"NEGATIVE_REPAIR_AFTER_STOP","command_id":"no-progress-stop","kind":"negative","mutation":"NEGATIVE_REPAIR_AFTER_STOP","expected":"DISPATCH_FORBIDDEN"},
    {"id":"NEGATIVE_BUDGET_PRECEDENCE","command_id":"no-progress-stop","kind":"negative","mutation":"NEGATIVE_BUDGET_PRECEDENCE","expected":"BUDGET_REPAIR_EXCEEDED"},
    {"id":"NEGATIVE_NONCANONICAL_SIGNATURE","command_id":"no-progress-stop","kind":"negative","mutation":"NEGATIVE_NONCANONICAL_SIGNATURE","expected":"PROGRESS_INPUT_INVALID"},
    {"id":"NEGATIVE_UNTRUSTED_PROGRESS","command_id":"no-progress-stop","kind":"negative","mutation":"NEGATIVE_UNTRUSTED_PROGRESS","expected":"NO_PROGRESS_STOPPED"},
    {"id":"POSITIVE_SUCCESS_TRACE","command_id":"trace-manifest-completeness","kind":"positive","mutation":"POSITIVE_SUCCESS_TRACE","expected":"PASSED"},
    {"id":"POSITIVE_CANCEL_TRACE","command_id":"trace-manifest-completeness","kind":"positive","mutation":"POSITIVE_CANCEL_TRACE","expected":"PASSED"},
    {"id":"POSITIVE_BUDGET_TRACE","command_id":"trace-manifest-completeness","kind":"positive","mutation":"POSITIVE_BUDGET_TRACE","expected":"PASSED"},
    {"id":"NEGATIVE_EVENT_GAP","command_id":"trace-manifest-completeness","kind":"negative","mutation":"NEGATIVE_EVENT_GAP","expected":"TRACE_SEQUENCE_INVALID"},
    {"id":"NEGATIVE_EVENT_REORDER","command_id":"trace-manifest-completeness","kind":"negative","mutation":"NEGATIVE_EVENT_REORDER","expected":"TRACE_SEQUENCE_INVALID"},
    {"id":"NEGATIVE_REVISION_DECREASE","command_id":"trace-manifest-completeness","kind":"negative","mutation":"NEGATIVE_REVISION_DECREASE","expected":"TRACE_REVISION_INVALID"},
    {"id":"NEGATIVE_ACTOR_INVALID","command_id":"trace-manifest-completeness","kind":"negative","mutation":"NEGATIVE_ACTOR_INVALID","expected":"TRACE_ACTOR_INVALID"},
    {"id":"NEGATIVE_EVIDENCE_DANGLING","command_id":"trace-manifest-completeness","kind":"negative","mutation":"NEGATIVE_EVIDENCE_DANGLING","expected":"TRACE_REFERENCE_INVALID"},
    {"id":"NEGATIVE_ARTIFACT_DANGLING","command_id":"trace-manifest-completeness","kind":"negative","mutation":"NEGATIVE_ARTIFACT_DANGLING","expected":"TRACE_REFERENCE_INVALID"},
    {"id":"NEGATIVE_CLEANUP_MISSING","command_id":"trace-manifest-completeness","kind":"negative","mutation":"NEGATIVE_CLEANUP_MISSING","expected":"TRACE_CLEANUP_INVALID"},
    {"id":"NEGATIVE_TERMINAL_REASON","command_id":"trace-manifest-completeness","kind":"negative","mutation":"NEGATIVE_TERMINAL_REASON","expected":"TRACE_TERMINAL_INVALID"},
    {"id":"NEGATIVE_NEXT_ACTION","command_id":"trace-manifest-completeness","kind":"negative","mutation":"NEGATIVE_NEXT_ACTION","expected":"TRACE_NEXT_ACTION_INVALID"},
    {"id":"POSITIVE_NO_EXTERNAL_WRITE","command_id":"external-write-negative","kind":"positive","mutation":"POSITIVE_NO_EXTERNAL_WRITE","expected":"PASSED"},
    {"id":"NEGATIVE_DIRECT_PUBLISH","command_id":"external-write-negative","kind":"negative","mutation":"NEGATIVE_DIRECT_PUBLISH","expected":"EXTERNAL_ACTION_FORBIDDEN"},
    {"id":"NEGATIVE_GATEWAY_BYPASS","command_id":"external-write-negative","kind":"negative","mutation":"NEGATIVE_GATEWAY_BYPASS","expected":"EXTERNAL_GATEWAY_REQUIRED"},
    {"id":"NEGATIVE_REMOTE_TARGET","command_id":"external-write-negative","kind":"negative","mutation":"NEGATIVE_REMOTE_TARGET","expected":"EXTERNAL_TARGET_INVALID"},
    {"id":"NEGATIVE_APPROVAL_ABSENT","command_id":"external-write-negative","kind":"negative","mutation":"NEGATIVE_APPROVAL_ABSENT","expected":"EXTERNAL_APPROVAL_REQUIRED"},
    {"id":"NEGATIVE_APPROVAL_MISMATCH","command_id":"external-write-negative","kind":"negative","mutation":"NEGATIVE_APPROVAL_MISMATCH","expected":"EXTERNAL_APPROVAL_INVALID"},
    {"id":"NEGATIVE_DUPLICATE_EFFECT","command_id":"external-write-negative","kind":"negative","mutation":"NEGATIVE_DUPLICATE_EFFECT","expected":"EXTERNAL_EFFECT_DUPLICATE"},
    {"id":"NEGATIVE_DENIAL_NOT_TRACED","command_id":"external-write-negative","kind":"negative","mutation":"NEGATIVE_DENIAL_NOT_TRACED","expected":"EXTERNAL_DENIAL_TRACE_MISSING"},
    {"id":"NEGATIVE_EFFECT_OBSERVED","command_id":"external-write-negative","kind":"negative","mutation":"NEGATIVE_EFFECT_OBSERVED","expected":"EXTERNAL_EFFECT_OBSERVED"},
    {"id":"NEGATIVE_RAW_SECRET","command_id":"external-write-negative","kind":"negative","mutation":"NEGATIVE_RAW_SECRET","expected":"RESULT_SECRET_DETECTED"}
  ]
}
